{
  "id": "ssh",
  "name": "OpenSSH ssh client",
  "version_context": "OpenSSH portable V_9_9_P2, commit 6221555579266c08cd024e53600c13ab585af98a",
  "summary": "The OpenSSH ssh client implementing layered SSH transport, user authentication, and connection-channel control for remote sessions, forwarding, and multiplexed data streams.",
  "scope": ["SSH client", "transport and authentication orchestration", "multiplexed channels", "remote command and terminal sessions", "TCP forwarding"],
  "features": [
    {"id": "layered-ssh-session-establishment", "name": "Layered SSH session establishment", "category": "security-protocol", "claim_type": "fact", "description": "OpenSSH's ssh client drives transport connection and key exchange, user authentication, and the ssh-connection service as separate protocol phases. The official OpenSSH overview describes transport confidentiality/integrity, authentication mechanisms, and connection-layer services as distinct layers.", "benefits": ["Separates cryptographic transport, identity proof, and channel services", "Permits authentication mechanisms and channel services to evolve within protocol boundaries"], "costs": ["Phase ordering and negotiated algorithms create compatibility state", "Security properties depend on correct host and user authentication policy"], "evidence_ids": ["ssh-source", "openssh-manual", "rfc4251", "rfc4252", "rfc4253"]},
    {"id": "multiplexed-flow-controlled-channels", "name": "Multiplexed flow-controlled channels", "category": "concurrency-model", "claim_type": "fact", "description": "The SSH connection protocol multiplexes sessions, forwarded TCP connections, and other services into channels over one encrypted connection. OpenSSH maintains channel objects, per-channel file descriptors, windows, packet sizes, callbacks, and lifecycle state.", "benefits": ["Shares one authenticated transport across several logical services", "Provides per-channel flow control and independent close semantics"], "costs": ["Channel windows and shared transport scheduling add coordination state", "A single connection failure can affect multiple logical channels"], "evidence_ids": ["channels-source", "rfc4254", "ssh-source"]},
    {"id": "session-command-and-forwarding-services", "name": "Session, command, and forwarding services", "category": "session-model", "claim_type": "fact", "description": "ssh can request a shell, remote command, subsystem, pseudo-terminal, X11 forwarding, or TCP forwarding through connection-layer channel and global requests. These are distinct service requests carried by the same channel framework.", "benefits": ["Unifies interactive login, command execution, and forwarding under one transport", "Allows service-specific requests without separate network connections"], "costs": ["Forwarding and agent/X11 capabilities expand authority beyond command execution", "Service success and remote process exit are reported asynchronously through channel messages"], "evidence_ids": ["rfc4254", "clientloop-source", "ssh-manual"]}
  ],
  "mathematical_views": [
    {"model": "SSH phase transition system", "question": "How does a client advance from transport setup through key exchange, authentication, service request, and channel operation?", "assumptions": ["Protocol phases have explicit success and failure transitions", "Negotiation and authentication results control later channel availability", "The view abstracts cryptographic primitive internals"], "claim_type": "inference", "evidence_ids": ["ssh-source", "openssh-manual", "rfc4251", "rfc4252", "rfc4253"]},
    {"model": "Channel flow-control graph", "question": "How do logical SSH channels share one connection while respecting per-channel windows and close state?", "assumptions": ["The encrypted connection is a shared transport vertex", "Channels are independently identified state vertices with window and packet constraints", "The view abstracts kernel sockets and event-loop scheduling"], "claim_type": "inference", "evidence_ids": ["channels-source", "rfc4254"]},
    {"model": "Forwarding capability relation", "question": "Which authenticated peers and channel requests can create sessions or forwarded TCP connections under client configuration?", "assumptions": ["Authentication establishes the principal before service requests", "Forwarding permissions are policy inputs rather than inherent protocol guarantees", "The relation does not infer authorization from mere channel syntax"], "claim_type": "inference", "evidence_ids": ["rfc4254", "ssh-manual", "clientloop-source"]}
  ],
  "trade_offs": [
    {"feature_id": "layered-ssh-session-establishment", "benefits": ["Clear separation of transport security, identity, and services"], "costs": ["Negotiation and phase failure handling increase protocol complexity"]},
    {"feature_id": "multiplexed-flow-controlled-channels", "benefits": ["Several logical services share one authenticated connection"], "costs": ["Per-channel flow control and shared failure boundaries require coordination"]},
    {"feature_id": "session-command-and-forwarding-services", "benefits": ["One client supports terminal, command, subsystem, and forwarding use cases"], "costs": ["Optional forwarding services increase authority and attack-surface assumptions"]}
  ],
  "evidence": [
    {"id": "ssh-fixed-source", "kind": "source-code", "title": "OpenSSH portable source at V_9_9_P2", "uri": "https://github.com/openssh/openssh-portable/commit/6221555579266c08cd024e53600c13ab585af98a", "accessed": "2026-10-24", "notes": "Fixed upstream source revision used for this card."},
    {"id": "ssh-source", "kind": "source-code", "title": "OpenSSH ssh client at fixed commit", "uri": "https://github.com/openssh/openssh-portable/blob/6221555579266c08cd024e53600c13ab585af98a/ssh.c", "accessed": "2026-10-24", "notes": "Fixed source for ssh client startup, option handling, connection setup, and session orchestration."},
    {"id": "clientloop-source", "kind": "source-code", "title": "OpenSSH client loop at fixed commit", "uri": "https://github.com/openssh/openssh-portable/blob/6221555579266c08cd024e53600c13ab585af98a/clientloop.c", "accessed": "2026-10-24", "notes": "Fixed source for client packet/event processing and session lifecycle."},
    {"id": "channels-source", "kind": "source-code", "title": "OpenSSH channel implementation at fixed commit", "uri": "https://github.com/openssh/openssh-portable/blob/6221555579266c08cd024e53600c13ab585af98a/channels.c", "accessed": "2026-10-24", "notes": "Fixed source for channel allocation, flow-control windows, callbacks, file descriptors, and close state."},
    {"id": "ssh-manual", "kind": "official-doc", "title": "OpenBSD ssh manual", "uri": "https://man.openbsd.org/ssh", "accessed": "2026-10-24", "notes": "Official manual for the ssh client, sessions, forwarding, and configuration behavior."},
    {"id": "openssh-manual", "kind": "official-doc", "title": "OpenSSH protocol and manual overview", "uri": "https://www.openssh.com/manual.html", "accessed": "2026-10-24", "notes": "Official OpenSSH overview of transport, authentication, and connection protocol layers."},
    {"id": "rfc4251", "kind": "official-doc", "title": "RFC 4251: SSH Protocol Architecture", "uri": "https://www.rfc-editor.org/rfc/rfc4251", "accessed": "2026-10-24", "notes": "IETF architecture specification for SSH protocol layers and services."},
    {"id": "rfc4252", "kind": "official-doc", "title": "RFC 4252: SSH Authentication Protocol", "uri": "https://www.rfc-editor.org/rfc/rfc4252", "accessed": "2026-10-24", "notes": "IETF specification for user authentication over the SSH transport."},
    {"id": "rfc4253", "kind": "official-doc", "title": "RFC 4253: SSH Transport Layer Protocol", "uri": "https://www.rfc-editor.org/rfc/rfc4253", "accessed": "2026-10-24", "notes": "IETF specification for algorithm negotiation, key exchange, confidentiality, and integrity."},
    {"id": "rfc4254", "kind": "official-doc", "title": "RFC 4254: SSH Connection Protocol", "uri": "https://www.rfc-editor.org/rfc/rfc4254", "accessed": "2026-10-24", "notes": "IETF specification for channels, sessions, flow control, and forwarding."}
  ],
  "related_systems": ["scp", "rsync", "mosh", "wireguard"]
}
